{
  "id": "stage4-3dgs-critique-20261010-v25",
  "title": "阶段4：critique表格范围修复核验-v25",
  "paperIds": [
    "803219bf205d0142621b1ac5339f8d918d3f883f814559f6336b8bfdec5ca634.pdf"
  ],
  "messages": [],
  "notes": [],
  "artifacts": [],
  "researchRuns": [],
  "activityHistory": [],
  "appliedRequestIds": [],
  "focusedPaperId": null,
  "activeActivity": null,
  "updatedAt": "2026-10-10T13:21:41.657174Z",
  "revision": 0
}